Location,Latitude,Longitude,Context,Presence
Brister’s Hill,42.44652602536891,-71.33549281708,"One old frequenter of these woods remembers, that as he passed her house one noon he heard her muttering to herself over her gurgling pot﻿—“Ye are all bones, bones!” I have seen bricks amid the oak copse there.
Down the road, on the right hand, on Brister’s Hill, lived Brister Freeman, “a handy Negro,” slave of Squire Cummings once﻿—there where grow still the apple trees which Brister planted and tended; large old trees now, but their fruit still wild and ciderish to my taste.",Both physically and mentally present
Brister’s Hill,42.44652602536891,-71.33549281708,"
Farther down the hill, on the left, on the old road in the woods, are marks of some homestead of the Stratton family; whose orchard once covered all the slope of Brister’s Hill, but was long since killed out by pitch pines, excepting a few stumps, whose old roots furnish still the wild stocks of many a thrifty village tree.",Unclear
Brister’s Hill,42.44652602536891,-71.33549281708,"He died in the road at the foot of Brister’s Hill shortly after I came to the woods, so that I have not remembered him as a neighbor.",Mentally present
Brister’s Hill,42.44652602536891,-71.33549281708,Nor was it much better by the carriage road from Brister’s Hill.,Unclear
Bunker Hill,38.8758445,-98.7039655,"I have no doubt that it was a principle they fought for, as much as our ancestors, and not to avoid a threepenny tax on their tea; and the results of this battle will be as important and memorable to those whom it concerns as those of the battle of Bunker Hill, at least.",Unclear
Sweden,59.6749712,14.5208584,This event happened previous to the expulsion of the tyrant Christiern the Second from Sweden.,Unclear
Lincoln,40.8088861,-96.7077751,"A few years before I lived in the woods there was what was called a “winged cat” in one of the farmhouses in Lincoln nearest the pond, Mr. Gilian Baker’s.",Physically present
Lincoln,40.8088861,-96.7077751,"In some places, within my own remembrance, the pines would scrape both sides of a chaise at once, and women and children who were compelled to go this way to Lincoln alone and on foot did it with fear, and often ran a good part of the distance.",Unclear
Lincoln,40.8088861,-96.7077751,But to return toward Lincoln.,Unclear
Lincoln,40.8088861,-96.7077751,"A very agricola laboriosus was I to travellers bound westward through Lincoln and Wayland to nobody knows where; they sitting at their ease in gigs, with elbows on knees, and reins loosely hanging in festoons; I the home-staying, laborious native of the soil.",Unclear
Lincoln,40.8088861,-96.7077751,"Flint’s, or Sandy Pond, in Lincoln, our greatest lake and inland sea, lies about a mile east of Walden.",Unclear
Lincoln,40.8088861,-96.7077751,"I was seated by the shore of a small pond, about a mile and a half south of the village of Concord and somewhat higher than it, in the midst of an extensive wood between that town and Lincoln, and about two miles south of that our only field known to fame, Concord Battle Ground; but I was so low in the woods that the opposite shore, half a mile off, like the rest, covered with wood, was my most distant horizon.",Unclear
Lincoln,40.8088861,-96.7077751,"The Lincoln hills rose up around me at the extremity of a snowy plain, in which I did not remember to have stood before; and the fishermen, at an indeterminable distance over the ice, moving slowly about with their wolfish dogs, passed for sealers, or Eskimo, or in misty weather loomed like fabulous creatures, and I did not know whether they were giants or pygmies.",Likely physically present (positive sentiment)
Lincoln,40.8088861,-96.7077751,"I took this course when I went to lecture in Lincoln in the evening, travelling in no road and passing no house between my own hut and the lecture room.",Unclear
Milldam,57.583831399999994,-4.476251909620288,"At rumor of his arrival all the Milldam sportsmen are on the alert, in gigs and on foot, two by two and three by three, with patent rifles and conical balls and spyglasses.",Unclear
New York,40.7127281,-74.0060152,"It is said that loons have been caught in the New York lakes eighty feet beneath the surface, with hooks set for trout﻿—though Walden is deeper than that.",Unclear
New York,40.7127281,-74.0060152,"They are but improved means to an unimproved end, an end which it was already but too easy to arrive at; as railroads lead to Boston or New York.",Likely physically present (positive sentiment)
New York,40.7127281,-74.0060152,"There, too, I admired, though I did not gather, the cranberries, small waxen gems, pendants of the meadow grass, pearly and red, which the farmer plucks with an ugly rake, leaving the smooth meadow in a snarl, heedlessly measuring them by the bushel and the dollar only, and sells the spoils of the meads to Boston and New York; destined to be jammed, to satisfy the tastes of lovers of Nature there.",Likely physically present (positive sentiment)
New York,40.7127281,-74.0060152,"Michaux, more than thirty years ago, says that the price of wood for fuel in New York and Philadelphia “nearly equals, and sometimes exceeds, that of the best wood in Paris, though this immense capital annually requires more than three hundred thousand cords, and is surrounded to the distance of three hundred miles by cultivated plains.”",Likely physically present (positive sentiment)
New York,40.7127281,-74.0060152,"Those summer days which some of my contemporaries devoted to the fine arts in Boston or Rome, and others to contemplation in India, and others to trade in London or New York, I thus, with the other farmers of New England, devoted to husbandry.",Likely physically present (positive sentiment)
New York,40.7127281,-74.0060152,"Let us settle ourselves, and work and wedge our feet downward through the mud and slush of opinion, and prejudice, and tradition, and delusion, and appearance, that alluvion which covers the globe, through Paris and London, through New York and Boston and Concord, through Church and State, through poetry and philosophy and religion, till we come to a hard bottom and rocks in place, which we can call reality, and say, This is, and no mistake; and then begin, having a point d’appui, below freshet and frost and fire, a place where you might found a wall or a state, or set a lamppost safely, or perhaps a gauge, not a Nilometer, but a Realometer, that future ages might know how deep a freshet of shams and appearances had gathered from time to time.",Unclear
Louisiana,30.8703881,-92.007126,"For hours, in fall days, I watched the ducks cunningly tack and veer and hold the middle of the pond, far from the sportsman; tricks which they will have less need to practise in Louisiana bayous.",Unclear
New England,44.2057083,-70.75378387447887,"The buckeye does not grow in New England, and the mockingbird is rarely heard here.",Unclear
New England,44.2057083,-70.75378387447887,"Everyone has heard the story which has gone the rounds of New England, of a strong and beautiful bug which came out of the dry leaf of an old table of apple-tree wood, which had stood in a farmer’s kitchen for sixty years, first in Connecticut, and afterward in Massachusetts﻿—from an egg deposited in the living tree many years earlier still, as appeared by counting the annual layers beyond it; which was heard gnawing out for several weeks, hatched perchance by the heat of an urn.",Likely physically present (positive sentiment)
New England,44.2057083,-70.75378387447887,"I would fain say something, not so much concerning the Chinese and Sandwich Islanders as you who read these pages, who are said to live in New England; something about your condition, especially your outward condition or circumstances in this world, in this town, what it is, whether it is necessary that it be as bad as it is, whether it cannot be improved as well as not.",Unclear
New England,44.2057083,-70.75378387447887,"Yet some, not wise, go to the other side of the globe, to barbarous and unhealthy regions, and devote themselves to trade for ten or twenty years, in order that they may live﻿—that is, keep comfortably warm﻿—and die in New England at last.",Unclear
New England,44.2057083,-70.75378387447887,"Even in our democratic New England towns the accidental possession of wealth, and its manifestation in dress and equipage alone, obtain for the possessor almost universal respect.",Likely physically present (positive sentiment)
New England,44.2057083,-70.75378387447887,"The secretary of the Province of New Netherland, writing in Dutch, in 1650, for the information of those who wished to take up land there, states more particularly that “those in New Netherland, and especially in New England, who have no means to build farmhouses at first according to their wishes, dig a square pit in the ground, cellar fashion, six or seven feet deep, as long and as broad as they think proper, case the earth inside with wood all round the wall, and line the wood with the bark of trees or something else to prevent the caving in of the earth; floor this cellar with plank, and wainscot it overhead for a ceiling, raise a roof of spars clear up, and cover the spars with bark or green sods, so that they can live dry and warm in these houses with their entire families for two, three, and four years, it being understood that partitions are run through those cellars which are adapted to the size of the family.",Unclear
New England,44.2057083,-70.75378387447887,"The wealthy and principal men in New England, in the beginning of the colonies, commenced their first dwelling-houses in this fashion for two reasons: firstly, in order not to waste time in building, and not to want food the next season; secondly, in order not to discourage poor laboring people whom they brought over in numbers from Fatherland.",Likely physically present (positive sentiment)
New England,44.2057083,-70.75378387447887,"Nearer yet to town, you come to Breed’s location, on the other side of the way, just on the edge of the wood; ground famous for the pranks of a demon not distinctly named in old mythology, who has acted a prominent and astounding part in our New England life, and deserves, as much as any mythological character, to have his biography written one day; who first comes in the guise of a friend or hired man, and then robs and murders the whole family﻿—New-England Rum.",Unclear
New England,44.2057083,-70.75378387447887,"Almost every New England boy among my contemporaries shouldered a fowling-piece between the ages of ten and fourteen; and his hunting and fishing grounds were not limited, like the preserves of an English nobleman, but were more boundless even than those of a savage.",Unclear
New England,44.2057083,-70.75378387447887,"If we will read newspapers, why not skip the gossip of Boston and take the best newspaper in the world at once?﻿—not be sucking the pap of “neutral family” papers, or browsing “Olive Branches” here in New England.",Likely physically present (positive sentiment)
New England,44.2057083,-70.75378387447887,"New England can hire all the wise men in the world to come and teach her, and board them round the while, and not be provincial at all.",Unclear
New England,44.2057083,-70.75378387447887,It is as much Asia or Africa as New England.,Unclear
New England,44.2057083,-70.75378387447887,"On this morning of the Great Snow, perchance, which is still raging and chilling men’s blood, I bear the muffled tone of their engine bell from out the fog bank of their chilled breath, which announces that the cars are coming, without long delay, notwithstanding the veto of a New England northeast snowstorm, and I behold the plowmen covered with snow and rime, their heads peering, above the mould-board which is turning down other than daisies and the nests of field mice, like boulders of the Sierra Nevada, that occupy an outside place in the universe.",Likely physically present (positive sentiment)
New England,44.2057083,-70.75378387447887,"I feel more like a citizen of the world at the sight of the palm-leaf which will cover so many flaxen New England heads the next summer, the Manilla hemp and coconut husks, the old junk, gunny bags, scrap iron, and rusty nails.",Unclear
New England,44.2057083,-70.75378387447887,"This closed car smells of salt fish, the strong New England and commercial scent, reminding me of the Grand Banks and the fisheries.",Likely physically present (positive sentiment)
New England,44.2057083,-70.75378387447887,"Those summer days which some of my contemporaries devoted to the fine arts in Boston or Rome, and others to contemplation in India, and others to trade in London or New York, I thus, with the other farmers of New England, devoted to husbandry.",Likely physically present (positive sentiment)
New England,44.2057083,-70.75378387447887,I perceive that we inhabitants of New England live this mean life that we do because our vision does not penetrate the surface of things.,Unclear
Canada,61.0666922,-107.991707,"The wild goose is more of a cosmopolite than we; he breaks his fast in Canada, takes a luncheon in the Ohio, and plumes himself for the night in a southern bayou.",Unclear
Canada,61.0666922,-107.991707,"But when I stood on the shore they at once rose up with a great flapping of wings at the signal of their commander, and when they had got into rank circled about over my head, twenty-nine of them, and then steered straight to Canada, with a regular honk from the leader at intervals, trusting to break their fast in muddier pools.",Likely physically present (positive sentiment)
Canada,61.0666922,-107.991707,"He was about twenty-eight years old, and had left Canada and his father’s house a dozen years before to work in the States, and earn money to buy a farm with at last, perhaps in his native country.",Unclear
Ohio,40.2253569,-82.6881395,"The wild goose is more of a cosmopolite than we; he breaks his fast in Canada, takes a luncheon in the Ohio, and plumes himself for the night in a southern bayou.",Unclear
Colorado,38.7251776,-105.607716,"Even the bison, to some extent, keeps pace with the seasons cropping the pastures of the Colorado only till a greener and sweeter grass awaits him by the Yellowstone.",Unclear
Yellowstone,45.9645464,-108.276076,"Even the bison, to some extent, keeps pace with the seasons cropping the pastures of the Colorado only till a greener and sweeter grass awaits him by the Yellowstone.",Unclear
Tierra del Fuego,-54.4071064,-67.8974895,"If you are chosen town clerk, forsooth, you cannot go to Tierra del Fuego this summer: but you may go to the land of infernal fire nevertheless.",Unclear
Tierra del Fuego,-54.4071064,-67.8974895,"Darwin, the naturalist, says of the inhabitants of Tierra del Fuego, that while his own party, who were well clothed and sitting close to a fire, were far from too warm, these naked savages, who were farther off, were observed, to his great surprise, “to be streaming with perspiration at undergoing such a roasting.”",Likely physically present (positive sentiment)
Africa,11.5024338,17.7578122,One hastens to southern Africa to chase the giraffe; but surely that is not the game he would be after.,Likely physically present (positive sentiment)
Africa,11.5024338,17.7578122,It is as much Asia or Africa as New England.,Unclear
West,18.7668687,-72.4387315,"The low shrub oak plateau to which the opposite shore arose stretched away toward the prairies of the West and the steppes of Tartary, affording ample room for all the roving families of men.",Unclear
Nile,46.836279,-120.94459953999998,"Is it the source of the Nile, or the Niger, or the Mississippi, or a Northwest Passage around this continent, that we would find?",Unclear
Nile,46.836279,-120.94459953999998,"As for the Pyramids, there is nothing to wonder at in them so much as the fact that so many men could be found degraded enough to spend their lives constructing a tomb for some ambitious booby, whom it would have been wiser and manlier to have drowned in the Nile, and then given his body to the dogs.",Unclear
Nile,46.836279,-120.94459953999998,"Or I was attracted by the passage of wild pigeons from this wood to that, with a slight quivering winnowing sound and carrier haste; or from under a rotten stump my hoe turned up a sluggish portentous and outlandish spotted salamander, a trace of Egypt and the Nile, yet our contemporary.",Unclear
Niger,17.7356214,9.3238432,"Is it the source of the Nile, or the Niger, or the Mississippi, or a Northwest Passage around this continent, that we would find?",Unclear
Mississippi,32.9715285,-89.7348497,"Is it the source of the Nile, or the Niger, or the Mississippi, or a Northwest Passage around this continent, that we would find?",Unclear
Mississippi,32.9715285,-89.7348497,"Start now on that farthest western way, which does not pause at the Mississippi or the Pacific, nor conduct toward a worn-out China or Japan, but leads on direct, a tangent to this sphere, summer and winter, day and night, sun down, moon down, and at last earth down too.",Unclear
a Northwest Passage,41.1754197,-85.13455033923398,"Is it the source of the Nile, or the Niger, or the Mississippi, or a Northwest Passage around this continent, that we would find?",Unclear
the Mungo Park,55.75734642119591,-4.190081656560633,"Be rather the Mungo Park, the Lewis and Clark and Frobisher, of your own streams and oceans; explore your own higher latitudes﻿—with shiploads of preserved meats to support you, if they be necessary; and pile the empty cans sky-high for a sign.",Unclear
the Lewis and Clark and,45.603000550000004,-121.18215033194784,"Be rather the Mungo Park, the Lewis and Clark and Frobisher, of your own streams and oceans; explore your own higher latitudes﻿—with shiploads of preserved meats to support you, if they be necessary; and pile the empty cans sky-high for a sign.",Unclear
Frobisher,49.2083214,-102.4277764,"Be rather the Mungo Park, the Lewis and Clark and Frobisher, of your own streams and oceans; explore your own higher latitudes﻿—with shiploads of preserved meats to support you, if they be necessary; and pile the empty cans sky-high for a sign.",Unclear
Atlantic,39.5143268,-74.6632883,"What was the meaning of that South-Sea Exploring Expedition, with all its parade and expense, but an indirect recognition of the fact that there are continents and seas in the moral world to which every man is an isthmus or an inlet, yet unexplored by him, but that it is easier to sail many thousand miles through cold and storm and cannibals, in a government ship, with five hundred men and boys to assist one, than it is to explore the private sea, the Atlantic and Pacific Ocean of one’s being alone.",Unclear
Atlantic,39.5143268,-74.6632883,"We are eager to tunnel under the Atlantic and bring the Old World some weeks nearer to the New; but perchance the first news that will leak through into the broad, flapping American ear will be that the Princess Adelaide has the whooping cough.",Unclear
Atlantic,39.5143268,-74.6632883,Even the sailor on the Atlantic and Pacific is awakened by his voice; but its shrill sound never roused me from my slumbers.,Unclear
Atlantic,39.5143268,-74.6632883,"With favoring winds it is wafted past the site of the fabulous islands of Atlantis and the Hesperides, makes the periplus of Hanno, and, floating by Ternate and Tidore and the mouth of the Persian Gulf, melts in the tropic gales of the Indian seas, and is landed in ports of which Alexander only heard the names.",Likely physically present (positive sentiment)
Pacific Ocean,-0.703107,-120.9375,"What was the meaning of that South-Sea Exploring Expedition, with all its parade and expense, but an indirect recognition of the fact that there are continents and seas in the moral world to which every man is an isthmus or an inlet, yet unexplored by him, but that it is easier to sail many thousand miles through cold and storm and cannibals, in a government ship, with five hundred men and boys to assist one, than it is to explore the private sea, the Atlantic and Pacific Ocean of one’s being alone.",Unclear
Zanzibar,-6.1664908,39.2074312,"
“Erret, et extremos alter scrutetur Iberos.
lus habet hic vitae, plus habet ille viae.
Let them wander and scrutinize the outlandish Australians
I have more of God, they more of the road.
It is not worth the while to go round the world to count the cats in Zanzibar.",Unclear
England,52.5310214,-1.2649062,"England and France, Spain and Portugal, Gold Coast and Slave Coast, all front on this private sea; but no bark from them has ventured out of sight of land, though it is without doubt the direct way to India.",Unclear
England,52.5310214,-1.2649062,"It is a ridiculous demand which England and America make, that you shall speak so that they can understand you.",Unclear
England,52.5310214,-1.2649062,"While England endeavors to cure the potato-rot, will not any endeavor to cure the brain-rot, which prevails so much more widely and fatally?",Unclear
England,52.5310214,-1.2649062,"They tell me of California and Texas, of England and the Indies, of the Hon. Mr. —﻿—﻿— of Georgia or of Massachusetts, all transient and fleeting phenomena, till I am ready to leap from their courtyard like the Mameluke bey.",Likely physically present (positive sentiment)
England,52.5310214,-1.2649062,"Such too, to a greater or less extent, is the condition of the operatives of every denomination in England, which is the great workhouse of the world.",Likely physically present (positive sentiment)
England,52.5310214,-1.2649062,"This spending of the best part of one’s life earning money in order to enjoy a questionable liberty during the least valuable part of it reminds me of the Englishman who went to India to make a fortune first, in order that he might return to England and live the life of a poet.",Likely physically present (positive sentiment)
England,52.5310214,-1.2649062,"I look upon England today as an old gentleman who is travelling with a great deal of baggage, trumpery which has accumulated from long housekeeping, which he has not the courage to burn; great trunk, little trunk, bandbox, and bundle.",Likely physically present (positive sentiment)
England,52.5310214,-1.2649062,"I once heard a reverend lecturer on England, a man of learning and intelligence, after enumerating her scientific, literary, and political worthies, Shakespeare, Bacon, Cromwell, Milton, Newton, and others, speak next of her Christian heroes, whom, as if his profession required it of him, he elevated to a place far above all the rest, as the greatest of the great.",Likely physically present (positive sentiment)
England,52.5310214,-1.2649062,"The last were not England’s best men and women; only, perhaps, her best philanthropists.",Unclear
England,52.5310214,-1.2649062,"They mistake who assert that the Yankee has few amusements, because he has not so many public holidays, and men and boys do not play so many games as they do in England, for here the more primitive but solitary amusements of hunting, fishing, and the like have not yet given place to the former.",Likely physically present (positive sentiment)
England,52.5310214,-1.2649062,"Such apparently slight causes destroyed Greece and Rome, and will destroy England and America.",Unclear
England,52.5310214,-1.2649062,"Gilpin, in his account of the forest borderers of England, says that “the encroachments of trespassers, and the houses and fences thus raised on the borders of the forest,” were “considered as great nuisances by the old forest law, and were severely punished under the name of purprestures, as tending ad terrorem ferarum﻿—ad nocumentum forestae, etc.,” to the frightening of the game and the detriment of the forest.",Unclear
England,52.5310214,-1.2649062,"As for Spain, for instance, if you know how to throw in Don Carlos and the Infanta, and Don Pedro and Seville and Granada, from time to time in the right proportions﻿—they may have changed the names a little since I saw the papers﻿—and serve up a bullfight when other entertainments fail, it will be true to the letter, and give us as good an idea of the exact state or ruin of things in Spain as the most succinct and lucid reports under this head in the newspapers: and as for England, almost the last significant scrap of news from that quarter was the revolution of 1649; and if you have learned the history of her crops for an average year, you never need attend to that thing again, unless your speculations are of a merely pecuniary character.",Physically present
Portugal,39.6621648,-8.1353519,"England and France, Spain and Portugal, Gold Coast and Slave Coast, all front on this private sea; but no bark from them has ventured out of sight of land, though it is without doubt the direct way to India.",Unclear
Gold Coast,-28.0023731,153.4145987,"England and France, Spain and Portugal, Gold Coast and Slave Coast, all front on this private sea; but no bark from them has ventured out of sight of land, though it is without doubt the direct way to India.",Unclear
Slave Coast,-4.6473978,39.3805105,"England and France, Spain and Portugal, Gold Coast and Slave Coast, all front on this private sea; but no bark from them has ventured out of sight of land, though it is without doubt the direct way to India.",Unclear
India,22.3511148,78.6677428,"England and France, Spain and Portugal, Gold Coast and Slave Coast, all front on this private sea; but no bark from them has ventured out of sight of land, though it is without doubt the direct way to India.",Unclear
