Location,Latitude,Longitude,Context,Presence
Ceres,45.3133772,7.3896883,"Some Indian Ceres or Minerva must have been the inventor and bestower of it; and when the reign of poetry commences here, its leaves and string of nuts may be represented on our works of art.",Unclear
Ceres,45.3133772,7.3896883,"He sacrifices not to Ceres and the Terrestrial Jove, but to the infernal Plutus rather.",Unclear
Ceres,45.3133772,7.3896883,"Cato says that the profits of agriculture are particularly pious or just (maximeque pius quaestus), and according to Varro the old Romans “called the same earth Mother and Ceres, and thought that they who cultivated it led a pious and useful life, and that they alone were left of the race of King Saturn.”",Mentally present
Mesopotamia,34.90348665,42.05888055600657,"Many of the villages of Mesopotamia are built of secondhand bricks of a very good quality, obtained from the ruins of Babylon, and the cement on them is older and probably harder still.",Unclear
Babylon,49.3975285,12.8617005,"Many of the villages of Mesopotamia are built of secondhand bricks of a very good quality, obtained from the ruins of Babylon, and the cement on them is older and probably harder still.",Unclear
the North West Territory,,,"How can the scholar, who dwells away in the North West Territory or the Isle of Man, tell what is parliamentary in the kitchen?",Unclear
the Isle of Man,54.15060185,-4.48240567663438,"How can the scholar, who dwells away in the North West Territory or the Isle of Man, tell what is parliamentary in the kitchen?",Unclear
Mexico,19.4326296,-99.1331785,"Night after night the geese came lumbering in the dark with a clangor and a whistling of wings, even after the ground was covered with snow, some to alight in Walden, and some flying low over the woods toward Fair Haven, bound for Mexico.",Unclear
Flint,43.0161693,-83.6900211,"In 1845 Walden froze entirely over for the first time on the night of the 22nd of December, Flint’s and other shallower ponds and the river having been frozen ten days or more; in ’46, the 16th; in ’49, about the 31st; and in ’50, about the 27th of December; in ’52, the 5th of January; in ’53, the 31st of December.",Unclear
Flint,43.0161693,-83.6900211,"One pleasant morning after a cold night, February 24th, 1850, having gone to Flint’s Pond to spend the day, I noticed with surprise, that when I struck the ice with the head of my axe, it resounded like a gong for many rods around, or as if I had struck on a tight drumhead.",Likely physically present (positive sentiment)
Flint,43.0161693,-83.6900211,"Flint’s Pond, a mile eastward, allowing for the disturbance occasioned by its inlets and outlets, and the smaller intermediate ponds also, sympathize with Walden, and recently attained their greatest height at the same time with the latter.",Unclear
Flint,43.0161693,-83.6900211,"Goose Pond, of small extent, is on my way to Flint’s; Fair Haven, an expansion of Concord River, said to contain some seventy acres, is a mile southwest; and White Pond, of about forty acres, is a mile and a half beyond Fair Haven.",Likely physically present (positive sentiment)
Philadelphia,39.9527237,-75.1635262,"Michaux, more than thirty years ago, says that the price of wood for fuel in New York and Philadelphia “nearly equals, and sometimes exceeds, that of the best wood in Paris, though this immense capital annually requires more than three hundred thousand cords, and is surrounded to the distance of three hundred miles by cultivated plains.”",Likely physically present (positive sentiment)
Walden vale,51.3746871,-2.334237600000002,"When the villagers were lighting their fires beyond the horizon, I too gave notice to the various wild inhabitants of Walden vale, by a smoky streamer from my chimney, that I was awake.﻿—


Light-winged Smoke, Icarian bird,

Melting thy pinions in thy upward flight,

Lark without song, and messenger of dawn,

Circling above the hamlets as thy nest;

Or else, departing dream, and shadowy form

Of midnight vision, gathering up thy skirts;

By night star-veiling, and by day

Darkening the light and blotting out the sun;

Go thou my incense upward from this hearth,

And ask the gods to pardon this clear flame.",Likely physically present (positive sentiment)
Europe,51.0,10.0,"But when the several nations of Europe had acquired distinct though rude written languages of their own, sufficient for the purposes of their rising literatures, then first learning revived, and scholars were enabled to discern from that remoteness the treasures of antiquity.",Unclear
Europe,51.0,10.0,"In this country, the village should in some respects take the place of the nobleman of Europe.",Unclear
Asia,51.2086975,89.2343748,It is as much Asia or Africa as New England.,Unclear
yonder star,,,"How far apart, think you, dwell the two most distant inhabitants of yonder star, the breadth of whose disk cannot be appreciated by our instruments?",Unclear
the Milky Way,52.364777700000005,4.881073026725959,is not our planet in the Milky Way?,Unclear
Beacon Hill,42.35684365,-71.06862657516852,"Not to many men surely, the depot, the post-office, the barroom, the meetinghouse, the schoolhouse, the grocery, Beacon Hill, or the Five Points, where men most congregate, but to the perennial source of our life, whence in all our experience we have found that to issue, as the willow stands near the water and sends out its roots in that direction.",Unclear
the Five Points,52.0793095,4.3168706,"Not to many men surely, the depot, the post-office, the barroom, the meetinghouse, the schoolhouse, the grocery, Beacon Hill, or the Five Points, where men most congregate, but to the perennial source of our life, whence in all our experience we have found that to issue, as the willow stands near the water and sends out its roots in that direction.",Unclear
Bright-town﻿—which,,,"And so I went home to my bed, and left him to pick his way through the darkness and the mud to Brighton﻿—or Bright-town﻿—which place he would reach some time in the morning.",Unclear
the Mill Brook,45.07665290317929,-64.48948994349546,"I am no more lonely than the Mill Brook, or a weathercock, or the north star, or the south wind, or an April shower, or a January thaw, or the first spider in a new house.",Unclear
Acheron,39.3151463,20.655792,"For my panacea, instead of one of those quack vials of a mixture dipped from Acheron and the Dead Sea, which come out of those long shallow black-schooner looking wagons which we sometimes see made to carry bottles, let me have a draught of undiluted morning air.",Unclear
the Dead Sea,40.7259787,-111.872331,"For my panacea, instead of one of those quack vials of a mixture dipped from Acheron and the Dead Sea, which come out of those long shallow black-schooner looking wagons which we sometimes see made to carry bottles, let me have a draught of undiluted morning air.",Unclear
the Dismal Swamp,-37.64563955,140.71517460619017,"
Far through unfrequented woods on the confines of towns, where once only the hunter penetrated by day, in the darkest night dart these bright saloons without the knowledge of their inhabitants; this moment stopping at some brilliant station-house in town or city, where a social crowd is gathered, the next in the Dismal Swamp, scaring the owl and fox.",Unclear
the Sierra Nevada,37.98600250626767,-1.138969824049793,"On this morning of the Great Snow, perchance, which is still raging and chilling men’s blood, I bear the muffled tone of their engine bell from out the fog bank of their chilled breath, which announces that the cars are coming, without long delay, notwithstanding the veto of a New England northeast snowstorm, and I behold the plowmen covered with snow and rime, their heads peering, above the mould-board which is turning down other than daisies and the nests of field mice, like boulders of the Sierra Nevada, that occupy an outside place in the universe.",Likely physically present (positive sentiment)
Lake Champlain,44.30846295,-73.32452197139881,"I am refreshed and expanded when the freight train rattles past me, and I smell the stores which go dispensing their odors all the way from Long Wharf to Lake Champlain, reminding me of foreign parts, of coral reefs, and Indian oceans, and tropical climes, and the extent of the globe.",Unclear
Manilla,14.5904492,120.9803621,"I feel more like a citizen of the world at the sight of the palm-leaf which will cover so many flaxen New England heads the next summer, the Manilla hemp and coconut husks, the old junk, gunny bags, scrap iron, and rusty nails.",Unclear
Milwaukee,43.0386475,-87.9090751,"These rags in bales, of all hues and qualities, the lowest condition to which cotton and linen descend, the final result of dress﻿—of patterns which are now no longer cried up, unless it be in Milwaukee, as those splendid articles, English, French, or American prints, ginghams, muslins, etc., gathered from all quarters both of fashion and poverty, going to become paper of one color or a few shades only, on which, forsooth, will be written tales of real life, high and low, and founded on fact!",Unclear
the Grand Banks,-33.9678346,151.1530229,"This closed car smells of salt fish, the strong New England and commercial scent, reminding me of the Grand Banks and the fisheries.",Likely physically present (positive sentiment)
Cuttingsville,43.4885205,-72.8816138,"Here is a hogshead of molasses or of brandy directed to John Smith, Cuttingsville, Vermont, some trader among the Green Mountains, who imports for the farmers near his clearing, and now perchance stands over his bulkhead and thinks of the last arrivals on the coast, how they may affect the price for him, telling his customers this moment, as he has told them twenty times before this morning, that he expects some by the next train of prime quality.",Unclear
Vermont,44.5990718,-72.5002608,"Here is a hogshead of molasses or of brandy directed to John Smith, Cuttingsville, Vermont, some trader among the Green Mountains, who imports for the farmers near his clearing, and now perchance stands over his bulkhead and thinks of the last arrivals on the coast, how they may affect the price for him, telling his customers this moment, as he has told them twenty times before this morning, that he expects some by the next train of prime quality.",Unclear
Vermont,44.5990718,-72.5002608,"He had worn the homemade Vermont gray, he said, and that was good.",Unclear
the Green Mountains,42.92931165,-71.46224000541625,"Here is a hogshead of molasses or of brandy directed to John Smith, Cuttingsville, Vermont, some trader among the Green Mountains, who imports for the farmers near his clearing, and now perchance stands over his bulkhead and thinks of the last arrivals on the coast, how they may affect the price for him, telling his customers this moment, as he has told them twenty times before this morning, that he expects some by the next train of prime quality.",Unclear
the Green Mountains,42.92931165,-71.46224000541625,"Warned by the whizzing sound, I look up from my book and see some tall pine, hewn on far northern hills, which has winged its way over the Green Mountains and the Connecticut, shot like an arrow through the township within ten minutes, and scarce another eye beholds it; going


“to be the mast

Of some great ammiral.",Likely physically present (positive sentiment)
the Green Mountains,42.92931165,-71.46224000541625,"Methinks I hear them barking behind the Peterboro’ Hills, or panting up the western slope of the Green Mountains.",Unclear
the Peterboro’ Hills,,,"Methinks I hear them barking behind the Peterboro’ Hills, or panting up the western slope of the Green Mountains.",Unclear
Nature,22.309171550000002,73.25776805856944,"Near at hand you could fancy it the most melancholy sound in Nature, as if she meant by this to stereotype and make permanent in her choir the dying moans of a human being﻿—some poor weak relic of mortality who has left hope behind, and howls like an animal, yet with human sobs, on entering the dark valley, made more awful by a certain gurgling melodiousness﻿—I find myself beginning with the letters gl when I try to imitate it﻿—expressive of a mind which has reached the gelatinous, mildewy stage in the mortification of all healthy and courageous thought.",Mentally present
the Great Snow﻿—no,,,Instead of no path to the front-yard gate in the Great Snow﻿—no gate﻿—no front-yard﻿—and no path to the civilized world.,Unclear
Sudbury,46.49272,-80.991211,"There was ice still on the meadows, but it was all gone out of the river, and he dropped down without obstruction from Sudbury, where he lived, to Fair Haven Pond, which he found, unexpectedly, covered for the most part with a firm field of ice.",Physically present
Sudbury,46.49272,-80.991211,"In the spring of ’49 I talked with the man who lives nearest the pond in Sudbury, who told me that it was he who got out this tree ten or fifteen years before.",Unclear
Sudbury,46.49272,-80.991211,"When I looked across the pond from this peak toward the Sudbury meadows, which in time of flood I distinguished elevated perhaps by a mirage in their seething valley, like a coin in a basin, all the earth beyond the pond appeared like a thin crust insulated and floated even by this small sheet of interverting water, and I was reminded that this on which I dwelt was but dry land.
Though the view from my door was still more contracted, I did not feel crowded or confined in the least.",Unclear
Fair Haven Pond,30.51248535,-84.45078095388996,"There was ice still on the meadows, but it was all gone out of the river, and he dropped down without obstruction from Sudbury, where he lived, to Fair Haven Pond, which he found, unexpectedly, covered for the most part with a firm field of ice.",Physically present
Earth,34.2331373,-102.4107493,"It convinces me that Earth is still in her swaddling-clothes, and stretches forth baby fingers on every side.",Unclear
Aurora,41.7571701,-88.3147539,"


“The East-Wind withdrew to Aurora and the Nabathæn kingdom,

And the Persian, and the ridges placed under the morning rays.",Unclear
Aurora,41.7571701,-88.3147539,"All poets and heroes, like Memnon, are the children of Aurora, and emit their music at sunrise.",Likely physically present (positive sentiment)
Wayland,42.3632063,-71.3606721,"A very agricola laboriosus was I to travellers bound westward through Lincoln and Wayland to nobody knows where; they sitting at their ease in gigs, with elbows on knees, and reins loosely hanging in festoons; I the home-staying, laborious native of the soil.",Unclear
Wayland,42.3632063,-71.3606721,"To me, away there in my bean-field at the other end of the town, the big guns sounded as if a puffball had burst; and when there was a military turnout of which I was ignorant, I have sometimes had a vague sense all the day of some sort of itching and disease in the horizon, as if some eruption would break out there soon, either scarlatina or canker-rash, until at length some more favorable puff of wind, making haste over the fields and up the Wayland road, brought me information of the “trainers.”",Unclear
Wayland,42.3632063,-71.3606721,"One old hunter who has a dry tongue, who used to come to bathe in Walden once every year when the water was warmest, and at such times looked in upon me, told me that many years ago he took his gun one afternoon and went out for a cruise in Walden Wood; and as he walked the Wayland road he heard the cry of hounds approaching, and ere long a fox leaped the wall into the road, and as quick as thought leaped the other wall out of the road, and his swift bullet had not touched him.",Both physically and mentally present
Egypt,26.2540493,29.2675469,"Or I was attracted by the passage of wild pigeons from this wood to that, with a slight quivering winnowing sound and carrier haste; or from under a rotten stump my hoe turned up a sluggish portentous and outlandish spotted salamander, a trace of Egypt and the Nile, yet our contemporary.",Unclear
Middlesex,51.546055800000005,-0.2537791389340719,"And when the sound died quite away, and the hum had ceased, and the most favorable breezes told no tale, I knew that they had got the last drone of them all safely into the Middlesex hive, and that now their minds were bent on the honey with which it was smeared.",Unclear
Palestine,31.7621153,-95.6307891,"These martial strains seemed as far away as Palestine, and reminded me of a march of crusaders in the horizon, with a slight tantivy and tremulous motion of the elm tree tops which overhang the village.",Unclear
the Terrestrial Jove,,,"He sacrifices not to Ceres and the Terrestrial Jove, but to the infernal Plutus rather.",Unclear
Arabia,22.3742506,49.477089111818884,"when I see them lying on the ice, or in the well which the fisherman cuts in the ice, making a little hole to admit the water, I am always surprised by their rare beauty, as if they were fabulous fishes, they are so foreign to the streets, even to the woods, foreign as Arabia to our Concord life.",Likely physically present (positive sentiment)
Bottomless Ponds,,,I have visited two such Bottomless Ponds in one walk in this neighborhood.,Physically present
the Infernal Regions,,,"Some who have lain flat on the ice for a long time, looking down through the illusive medium, perchance with watery eyes into the bargain, and driven to hasty conclusions by the fear of catching cold in their breasts, have seen vast holes “into which a load of hay might be driven,” if there were anybody to drive it, the undoubted source of the Styx and entrance to the Infernal Regions from these parts.",Physically present
Loch Fyne,56.035399299999995,-5.31652490762215,"William Gilpin, who is so admirable in all that relates to landscapes, and usually so correct, standing at the head of Loch Fyne, in Scotland, which he describes as “a bay of salt water, sixty or seventy fathoms deep, four miles in breadth,” and about fifty miles long, surrounded by mountains, observes, “If we could have seen it immediately after the diluvian crash, or whatever convulsion of nature occasioned it, before the waters gushed in, what a horrid chasm must it have appeared!",Unclear
Loch Fyne,56.035399299999995,-5.31652490762215,"But if, using the shortest diameter of Loch Fyne, we apply these proportions to Walden, which, as we have seen, appears already in a vertical section only like a shallow plate, it will appear four times as shallow.",Likely physically present (positive sentiment)
Loch Fyne,56.035399299999995,-5.31652490762215,So much for the increased horrors of the chasm of Loch Fyne when emptied.,Unclear
Scotland,56.7861112,-4.1140518,"William Gilpin, who is so admirable in all that relates to landscapes, and usually so correct, standing at the head of Loch Fyne, in Scotland, which he describes as “a bay of salt water, sixty or seventy fathoms deep, four miles in breadth,” and about fifty miles long, surrounded by mountains, observes, “If we could have seen it immediately after the diluvian crash, or whatever convulsion of nature occasioned it, before the waters gushed in, what a horrid chasm must it have appeared!",Unclear
Cape,8.2260166,123.4928834,"Cape becomes bar, and plain shoal, and valley and gorge deep water and channel.",Unclear
White Pond,33.4265352,-81.4739955,"Given, then, the length and breadth of the cove, and the character of the surrounding shore, and you have almost elements enough to make out a formula for all cases.
In order to see how nearly I could guess, with this experience, at the deepest point in a pond, by observing the outlines of a surface and the character of its shores alone, I made a plan of White Pond, which contains about forty-one acres, and, like this, has no island in it, nor any visible inlet or outlet; and as the line of greatest breadth fell very near the line of least breadth, where two opposite capes approached each other and two opposite bays receded, I ventured to mark a point a short distance from the latter line, but still on the line of greatest length, as the deepest.",Likely physically present (positive sentiment)
White Pond,33.4265352,-81.4739955,"We have one other pond just like this, White Pond, in Nine Acre Corner, about two and a half miles westerly; but, though I am acquainted with most of the ponds within a dozen miles of this centre I do not know a third of this pure and well-like character.",Unclear
White Pond,33.4265352,-81.4739955,"The same is true, as far as my observation goes, of White Pond.",Unclear
White Pond,33.4265352,-81.4739955,"Goose Pond, of small extent, is on my way to Flint’s; Fair Haven, an expansion of Concord River, said to contain some seventy acres, is a mile southwest; and White Pond, of about forty acres, is a mile and a half beyond Fair Haven.",Likely physically present (positive sentiment)
White Pond,33.4265352,-81.4739955,"
Since the woodcutters, and the railroad, and I myself have profaned Walden, perhaps the most attractive, if not the most beautiful, of all our lakes, the gem of the woods, is White Pond;﻿—a poor name from its commonness, whether derived from the remarkable purity of its waters or the color of its sands.",Unclear
White Pond,33.4265352,-81.4739955,"
White Pond and Walden are great crystals on the surface of the earth, Lakes of Light.",Likely physically present (positive sentiment)
Tartarus,-41.9380197,146.0335232340783,"But sometimes Squaw Walden had her revenge, and a hired man, walking behind his team, slipped through a crack in the ground down toward Tartarus, and he who was so brave before suddenly became but the ninth part of a man, almost gave up his animal heat, and was glad to take refuge in my house, and acknowledged that there was some virtue in a stove; or sometimes the frozen soil took a piece of steel out of a plowshare, or a plow got set in the furrow and had to be cut out.",Likely physically present (positive sentiment)
Fresh Pond,40.7070471,-73.90347,They told me that they had some in the icehouses at Fresh Pond five years old which was as good as ever.,Likely physically present (positive sentiment)
Charleston,32.7884363,-79.9399309,"Thus it appears that the sweltering inhabitants of Charleston and New Orleans, of Madras and Bombay and Calcutta, drink at my well.",Unclear
New Orleans,29.9759983,-90.0782127,"Thus it appears that the sweltering inhabitants of Charleston and New Orleans, of Madras and Bombay and Calcutta, drink at my well.",Unclear
Madras,44.6334544,-121.129487,"Thus it appears that the sweltering inhabitants of Charleston and New Orleans, of Madras and Bombay and Calcutta, drink at my well.",Unclear
Bombay,19.054999,72.8692035,"Thus it appears that the sweltering inhabitants of Charleston and New Orleans, of Madras and Bombay and Calcutta, drink at my well.",Unclear
Calcutta,22.5726459,88.3638953,"Thus it appears that the sweltering inhabitants of Charleston and New Orleans, of Madras and Bombay and Calcutta, drink at my well.",Unclear
Ganges,27.3034645,77.7092971,"I lay down the book and go to my well for water, and lo! there I meet the servant of the Bramin, priest of Brahma and Vishnu and Indra, who still sits in his temple on the Ganges reading the Vedas, or dwells at the root of a tree with his crust and water jug.",Unclear
Ganges,27.3034645,77.7092971,The pure Walden water is mingled with the sacred water of the Ganges.,Unclear
Ganges,27.3034645,77.7092971,"Now the trunks of trees on the bottom, and the old log canoe, and the dark surrounding woods, are gone, and the villagers, who scarcely know where it lies, instead of going to the pond to bathe or drink, are thinking to bring its water, which should be as sacred as the Ganges at least, to the village in a pipe, to wash their dishes with!﻿—to earn their Walden by the turning of a cock or drawing of a plug!",Unclear
Hesperides,27.9433011,-82.5286006,"With favoring winds it is wafted past the site of the fabulous islands of Atlantis and the Hesperides, makes the periplus of Hanno, and, floating by Ternate and Tidore and the mouth of the Persian Gulf, melts in the tropic gales of the Indian seas, and is landed in ports of which Alexander only heard the names.",Likely physically present (positive sentiment)
Ternate,45.7822863,8.6903182,"With favoring winds it is wafted past the site of the fabulous islands of Atlantis and the Hesperides, makes the periplus of Hanno, and, floating by Ternate and Tidore and the mouth of the Persian Gulf, melts in the tropic gales of the Indian seas, and is landed in ports of which Alexander only heard the names.",Likely physically present (positive sentiment)
Tidore,0.6786796,127.4483156,"With favoring winds it is wafted past the site of the fabulous islands of Atlantis and the Hesperides, makes the periplus of Hanno, and, floating by Ternate and Tidore and the mouth of the Persian Gulf, melts in the tropic gales of the Indian seas, and is landed in ports of which Alexander only heard the names.",Likely physically present (positive sentiment)
the Persian Gulf,34.0554039,-118.442059,"With favoring winds it is wafted past the site of the fabulous islands of Atlantis and the Hesperides, makes the periplus of Hanno, and, floating by Ternate and Tidore and the mouth of the Persian Gulf, melts in the tropic gales of the Indian seas, and is landed in ports of which Alexander only heard the names.",Likely physically present (positive sentiment)
