Location,Latitude,Longitude,Context,Presence
Flint’s Pond,51.520076,-1.097111411815811,"Sometimes I rambled to pine groves, standing like temples, or like fleets at sea, full-rigged, with wavy boughs, and rippling with light, so soft and green and shady that the Druids would have forsaken their oaks to worship in them; or to the cedar wood beyond Flint’s Pond, where the trees, covered with hoary blue berries, spiring higher and higher, are fit to stand before Valhalla, and the creeping juniper covers the ground with wreaths full of fruit; or to swamps where the usnea lichen hangs in festoons from the white spruce trees, and toadstools, round tables of the swamp gods, cover the ground, and more beautiful fungi adorn the stumps, like butterflies or shells, vegetable winkles; where the swamp-pink and dogwood grow, the red alderberry glows like eyes of imps, the waxwork grooves and crushes the hardest woods in its folds, and the wild holly berries make the beholder forget his home with their beauty, and he is dazzled and tempted by nameless other wild forbidden fruits, too fair for mortal taste.",Likely physically present (positive sentiment)
Flint’s Pond,51.520076,-1.097111411815811,"It commonly opens about the first of April, a week or ten days later than Flint’s Pond and Fair Haven, beginning to melt on the north side and in the shallower parts where it began to freeze.",Unclear
Flint’s Pond,51.520076,-1.097111411815811,"A thermometer thrust into the middle of Walden on the 6th of March, 1847, stood at 32°, or freezing point; near the shore at 33°; in the middle of Flint’s Pond, the same day, at 32½°; at a dozen rods from the shore, in shallow water, under ice a foot thick, at 36°.",Unclear
Flint’s Pond,51.520076,-1.097111411815811,"
I have said that Walden has no visible inlet nor outlet, but it is on the one hand distantly and indirectly related to Flint’s Pond, which is more elevated, by a chain of small ponds coming from that quarter, and on the other directly and manifestly to Concord River, which is lower, by a similar chain of ponds through which in some other geological period it may have flowed, and by a little digging, which God forbid, it can be made to flow thither again.",Unclear
Flint’s Pond,51.520076,-1.097111411815811,"If by living thus reserved and austere, like a hermit in the woods, so long, it has acquired such wonderful purity, who would not regret that the comparatively impure waters of Flint’s Pond should be mingled with it, or itself should ever go to waste its sweetness in the ocean wave?",Likely physically present (positive sentiment)
Flint’s Pond,51.520076,-1.097111411815811,"
Flint’s Pond!",Unclear
Flint’s Pond,51.520076,-1.097111411815811,"When I crossed Flint’s Pond, after it was covered with snow, though I had often paddled about and skated over it, it was so unexpectedly wide and so strange that I could think of nothing but Baffin’s Bay.",Unclear
St.,0.9713095,7.02255,"Benvenuto Cellini tells us in his memoirs, that, after a certain terrible dream or vision which he had during his confinement in the castle of St. Angelo a resplendent light appeared over the shadow of his head at morning and evening, whether he was in Italy or France, and it was particularly conspicuous when the grass was moist with dew.",Unclear
St.,0.9713095,7.02255,"It is said that a flood-tide, with a westerly wind, and ice in the Neva, would sweep St. Petersburg from the face of the earth.",Unclear
St.,0.9713095,7.02255,Napoleon went to St. Helena; Quoil came to Walden Woods.,Unclear
Italy,42.6384261,12.674297,"Benvenuto Cellini tells us in his memoirs, that, after a certain terrible dream or vision which he had during his confinement in the castle of St. Angelo a resplendent light appeared over the shadow of his head at morning and evening, whether he was in Italy or France, and it was particularly conspicuous when the grass was moist with dew.",Unclear
France,46.603354,1.8883335,"Benvenuto Cellini tells us in his memoirs, that, after a certain terrible dream or vision which he had during his confinement in the castle of St. Angelo a resplendent light appeared over the shadow of his head at morning and evening, whether he was in Italy or France, and it was particularly conspicuous when the grass was moist with dew.",Unclear
France,46.603354,1.8883335,"England and France, Spain and Portugal, Gold Coast and Slave Coast, all front on this private sea; but no bark from them has ventured out of sight of land, though it is without doubt the direct way to India.",Unclear
Fair Haven,40.3606653,-74.0381947,"I set out one afternoon to go a-fishing to Fair Haven, through the woods, to eke out my scanty fare of vegetables.",Unclear
Fair Haven,40.3606653,-74.0381947,"Night after night the geese came lumbering in the dark with a clangor and a whistling of wings, even after the ground was covered with snow, some to alight in Walden, and some flying low over the woods toward Fair Haven, bound for Mexico.",Unclear
Fair Haven,40.3606653,-74.0381947,"It commonly opens about the first of April, a week or ten days later than Flint’s Pond and Fair Haven, beginning to melt on the north side and in the shallower parts where it began to freeze.",Unclear
Fair Haven,40.3606653,-74.0381947,"I have sometimes disturbed a fish hawk sitting on a white pine over the water; but I doubt if it is ever profaned by the wind of a gull, like Fair Haven.",Unclear
Fair Haven,40.3606653,-74.0381947,"Goose Pond, of small extent, is on my way to Flint’s; Fair Haven, an expansion of Concord River, said to contain some seventy acres, is a mile southwest; and White Pond, of about forty acres, is a mile and a half beyond Fair Haven.",Likely physically present (positive sentiment)
Fair Haven,40.3606653,-74.0381947,"Goose Pond, of small extent, is on my way to Flint’s; Fair Haven, an expansion of Concord River, said to contain some seventy acres, is a mile southwest; and White Pond, of about forty acres, is a mile and a half beyond Fair Haven.",Likely physically present (positive sentiment)
Fair Haven,40.3606653,-74.0381947,"They passed over the pond toward Fair Haven, seemingly deterred from settling by my light, their commodore honking all the while with a regular beat.",Unclear
Fair Haven,40.3606653,-74.0381947,"Late in the afternoon, as he was resting in the thick woods south of Walden, he heard the voice of the hounds far over toward Fair Haven still pursuing the fox; and on they came, their hounding cry which made all the woods ring sounding nearer and nearer, now from Well Meadow, now from the Baker Farm.",Unclear
Pleasant Meadow,42.544784449999995,-83.23456590606426,"My way led through Pleasant Meadow, an adjunct of the Baker Farm, that retreat of which a poet has since sung, beginning﻿—


“Thy entry is a pleasant field,

Which some mossy fruit trees yield

Partly to a ruddy brook,

By gliding musquash undertook,

And mercurial trout,

Darting about.”


I thought of living there before I went to Walden.",Mentally present
Walden,41.5612048,-74.1884806,"My way led through Pleasant Meadow, an adjunct of the Baker Farm, that retreat of which a poet has since sung, beginning﻿—


“Thy entry is a pleasant field,

Which some mossy fruit trees yield

Partly to a ruddy brook,

By gliding musquash undertook,

And mercurial trout,

Darting about.”


I thought of living there before I went to Walden.",Mentally present
Walden,41.5612048,-74.1884806,"Like the wasps, before I finally went into winter quarters in November, I used to resort to the northeast side of Walden, which the sun, reflected from the pitch pine woods and the stony shore, made the fireside of the pond; it is so much pleasanter and wholesomer to be warmed by the sun while you can be, than by an artificial fire.",Likely physically present (positive sentiment)
Walden,41.5612048,-74.1884806,"Night after night the geese came lumbering in the dark with a clangor and a whistling of wings, even after the ground was covered with snow, some to alight in Walden, and some flying low over the woods toward Fair Haven, bound for Mexico.",Unclear
Walden,41.5612048,-74.1884806,"In 1845 Walden froze entirely over for the first time on the night of the 22nd of December, Flint’s and other shallower ponds and the river having been frozen ten days or more; in ’46, the 16th; in ’49, about the 31st; and in ’50, about the 27th of December; in ’52, the 5th of January; in ’53, the 31st of December.",Unclear
Walden,41.5612048,-74.1884806,"In the meanwhile all the shore rang with the trump of bullfrogs, the sturdy spirits of ancient wine-bibbers and wassailers, still unrepentant, trying to sing a catch in their Stygian lake﻿—if the Walden nymphs will pardon the comparison, for though there are almost no weeds, there are frogs there﻿—who would fain keep up the hilarious rules of their old festal tables, though their voices have waxed hoarse and solemnly grave, mocking at mirth, and the wine has lost its flavor, and become only liquor to distend their paunches, and sweet intoxication never comes to drown the memory of the past, but mere saturation and waterloggedness and distention.",Likely physically present (positive sentiment)
Walden,41.5612048,-74.1884806,"But such was not the effect on Walden that year, for she had soon got a thick new garment to take the place of the old.",Unclear
Walden,41.5612048,-74.1884806,"A severe cold of a few days’ duration in March may very much retard the opening of the former ponds, while the temperature of Walden increases almost uninterruptedly.",Unclear
Walden,41.5612048,-74.1884806,"A thermometer thrust into the middle of Walden on the 6th of March, 1847, stood at 32°, or freezing point; near the shore at 33°; in the middle of Flint’s Pond, the same day, at 32½°; at a dozen rods from the shore, in shallow water, under ice a foot thick, at 36°.",Unclear
Walden,41.5612048,-74.1884806,"When a warm rain in the middle of the winter melts off the snow-ice from Walden, and leaves a hard dark or transparent ice on the middle, there will be a strip of rotten though thicker white ice, a rod or more wide, about the shores, created by this reflected heat.",Unclear
Walden,41.5612048,-74.1884806,"In 1845 Walden was first completely open on the 1st of April; in ’46, the 25th of March; in ’47, the 8th of April; in ’51, the 28th of March; in ’52, the 18th of April; in ’53, the 23rd of March; in ’54, about the 7th of April.",Unclear
Walden,41.5612048,-74.1884806,Walden is melting apace.,Unclear
Walden,41.5612048,-74.1884806,"In the morning I watched the geese from the door through the mist, sailing in the middle of the pond, fifty rods off, so large and tumultuous that Walden appeared like an artificial pond for their amusement.",Likely physically present (positive sentiment)
Walden,41.5612048,-74.1884806,"I finally left Walden September 6th, 1847.",Unclear
Walden,41.5612048,-74.1884806,"
Ah, the pickerel of Walden!",Unclear
Walden,41.5612048,-74.1884806,"They are not green like the pines, nor gray like the stones, nor blue like the sky; but they have, to my eyes, if possible, yet rarer colors, like flowers and precious stones, as if they were the pearls, the animalized nuclei or crystals of the Walden water.",Unclear
Walden,41.5612048,-74.1884806,"They, of course, are Walden all over and all through; are themselves small Waldens in the animal kingdom, Waldenses.",Unclear
Walden,41.5612048,-74.1884806,"It is surprising that they are caught here﻿—that in this deep and capacious spring, far beneath the rattling teams and chaises and tinkling sleighs that travel the Walden road, this great gold and emerald fish swims.",Likely physically present (positive sentiment)
Walden,41.5612048,-74.1884806,"But if, using the shortest diameter of Loch Fyne, we apply these proportions to Walden, which, as we have seen, appears already in a vertical section only like a shallow plate, it will appear four times as shallow.",Likely physically present (positive sentiment)
Walden,41.5612048,-74.1884806,"Like the water, the Walden ice, seen near at hand, has a green tint, but at a distance is beautifully blue, and you can easily tell it from the white ice of the river, or the merely greenish ice of some ponds, a quarter of a mile off.",Likely physically present (positive sentiment)
Walden,41.5612048,-74.1884806,"I have noticed that a portion of Walden which in the state of water was green will often, when frozen, appear from the same point of view blue.",Unclear
Walden,41.5612048,-74.1884806,"Thus for sixteen days I saw from my window a hundred men at work like busy husbandmen, with teams and horses and apparently all the implements of farming, such a picture as we see on the first page of the almanac; and as often as I looked out I was reminded of the fable of the lark and the reapers, or the parable of the sower, and the like; and now they are all gone, and in thirty days more, probably, I shall look from the same window on the pure sea-green Walden water there, reflecting the clouds and the trees, and sending up its evaporations in solitude, and no traces will appear that a man has ever stood there.",Physically present
Walden,41.5612048,-74.1884806,The pure Walden water is mingled with the sacred water of the Ganges.,Unclear
Walden,41.5612048,-74.1884806,"

The scenery of Walden is on a humble scale, and, though very beautiful, does not approach to grandeur, nor can it much concern one who has not long frequented it or lived by its shore; yet this pond is so remarkable for its depth and purity as to merit a particular description.",Physically present
Walden,41.5612048,-74.1884806,"Walden is blue at one time and green at another, even from the same point of view.",Unclear
Walden,41.5612048,-74.1884806,How large a body of Walden water would be required to reflect a green tint I have never proved.,Unclear
Walden,41.5612048,-74.1884806,"Flint’s Pond, a mile eastward, allowing for the disturbance occasioned by its inlets and outlets, and the smaller intermediate ponds also, sympathize with Walden, and recently attained their greatest height at the same time with the latter.",Unclear
Walden,41.5612048,-74.1884806,"This rise and fall of Walden at long intervals serves this use at least; the water standing at this great height for a year or more, though it makes it difficult to walk round it, kills the shrubs and trees which have sprung up about its edge since the last rise﻿—pitch pines, birches, alders, aspens, and others﻿—and, falling again, leaves an unobstructed shore; for, unlike many ponds and all waters which are subject to a daily tide, its shore is cleanest when the water is lowest.",Unclear
Walden,41.5612048,-74.1884806,"Moreover, in summer, Walden never becomes so warm as most water which is exposed to the sun, on account of its depth.",Unclear
Walden,41.5612048,-74.1884806,"There have been caught in Walden pickerel, one weighing seven pounds﻿—to say nothing of another which carried off a reel with great velocity, which the fisherman safely set down at eight pounds because he did not see him﻿—perch and pouts, some of each weighing over two pounds, shiners, chivins or roach (Leuciscus pulchellus), a very few breams, and a couple of eels, one weighing four pounds﻿—I am thus particular because the weight of a fish is commonly its only title to fame, and these are the only eels I have heard of here;﻿—also, I have a faint recollection of a little fish some five inches long, with silvery sides and a greenish back, somewhat dace-like in its character, which I mention here chiefly to link my facts to fable.",Likely physically present (positive sentiment)
Walden,41.5612048,-74.1884806,"
When I first paddled a boat on Walden, it was completely surrounded by thick and lofty pine and oak woods, and in some of its coves grapevines had run over the trees next the water and formed bowers under which a boat could pass.",Unclear
Walden,41.5612048,-74.1884806,"Now the trunks of trees on the bottom, and the old log canoe, and the dark surrounding woods, are gone, and the villagers, who scarcely know where it lies, instead of going to the pond to bathe or drink, are thinking to bring its water, which should be as sacred as the Ganges at least, to the village in a pipe, to wash their dishes with!﻿—to earn their Walden by the turning of a cock or drawing of a plug!",Unclear
Walden,41.5612048,-74.1884806,"That devilish Iron Horse, whose ear-rending neigh is heard throughout the town, has muddied the Boiling Spring with his foot, and he it is that has browsed off all the woods on Walden shore, that Trojan horse, with a thousand men in his belly, introduced by mercenary Greeks!",Unclear
Walden,41.5612048,-74.1884806,"It struck me again tonight, as if I had not seen it almost daily for more than twenty years﻿—Why, here is Walden, the same woodland lake that I discovered so many years ago; where a forest was cut down last winter another is springing up by its shore as lustily as ever; the same thought is welling up to its surface that was then; it is the same liquid joy and happiness to itself and its Maker, ay, and it may be to me.",Mentally present
Walden,41.5612048,-74.1884806,"It is no dream of mine,

To ornament a line;

I cannot come nearer to God and Heaven

Than I live to Walden even.

",Likely physically present (positive sentiment)
Walden,41.5612048,-74.1884806,"Flint’s, or Sandy Pond, in Lincoln, our greatest lake and inland sea, lies about a mile east of Walden.",Unclear
Walden,41.5612048,-74.1884806,"
Since the woodcutters, and the railroad, and I myself have profaned Walden, perhaps the most attractive, if not the most beautiful, of all our lakes, the gem of the woods, is White Pond;﻿—a poor name from its commonness, whether derived from the remarkable purity of its waters or the color of its sands.",Unclear
Walden,41.5612048,-74.1884806,"
White Pond and Walden are great crystals on the surface of the earth, Lakes of Light.",Likely physically present (positive sentiment)
Walden,41.5612048,-74.1884806,"Walden, being like the rest usually bare of snow, or with only shallow and interrupted drifts on it, was my yard where I could walk freely when the snow was nearly two feet deep on a level elsewhere and the villagers were confined to their streets.",Unclear
Walden,41.5612048,-74.1884806,"A hunter told me that he once saw a fox pursued by hounds burst out on to Walden when the ice was covered with shallow puddles, run part way across, and then return to the same shore.",Physically present
Walden,41.5612048,-74.1884806,"One old hunter who has a dry tongue, who used to come to bathe in Walden once every year when the water was warmest, and at such times looked in upon me, told me that many years ago he took his gun one afternoon and went out for a cruise in Walden Wood; and as he walked the Wayland road he heard the cry of hounds approaching, and ere long a fox leaped the wall into the road, and as quick as thought leaped the other wall out of the road, and his swift bullet had not touched him.",Both physically and mentally present
Walden,41.5612048,-74.1884806,"Late in the afternoon, as he was resting in the thick woods south of Walden, he heard the voice of the hounds far over toward Fair Haven still pursuing the fox; and on they came, their hounding cry which made all the woods ring sounding nearer and nearer, now from Well Meadow, now from the Baker Farm.",Unclear
America,39.7837304,-100.445882,I had sat there many times of old before the ship was built that floated his family to America.,Unclear
America,39.7837304,-100.445882,"I tried to help him with my experience, telling him that he was one of my nearest neighbors, and that I too, who came a-fishing here, and looked like a loafer, was getting my living like himself; that I lived in a tight, light, and clean house, which hardly cost more than the annual rent of such a ruin as his commonly amounts to; and how, if he chose, he might in a month or two build himself a palace of his own; that I did not use tea, nor coffee, nor butter, nor milk, nor fresh meat, and so did not have to work to get them; again, as I did not work hard, I did not have to eat hard, and it cost me but a trifle for my food; but as he began with tea, and coffee, and butter, and milk, and beef, he had to work hard to pay for them, and when he had worked hard he had to eat hard again to repair the waste of his system﻿—and so it was as broad as it was long, indeed it was broader than it was long, for he was discontented and wasted his life into the bargain; and yet he had rated it as a gain in coming to America, that here you could get tea, and coffee, and meat every day.",Physically present
America,39.7837304,-100.445882,"But the only true America is that country where you are at liberty to pursue such a mode of life as may enable you to do without these, and where the state does not endeavor to compel you to sustain the slavery and war and other superfluous expenses which directly or indirectly result from the use of such things.",Unclear
America,39.7837304,-100.445882,"And certainly there is not the fight recorded in Concord history, at least, if in the history of America, that will bear a moment’s comparison with this, whether for the numbers engaged in it, or for the patriotism and heroism displayed.",Likely physically present (positive sentiment)
America,39.7837304,-100.445882,"It is a ridiculous demand which England and America make, that you shall speak so that they can understand you.",Unclear
America,39.7837304,-100.445882,"The head monkey at Paris puts on a traveller’s cap, and all the monkeys in America do the same.",Unclear
America,39.7837304,-100.445882,"Leaven, which some deem the soul of bread, the spiritus which fills its cellular tissue, which is religiously preserved like the vestal fire﻿—some precious bottleful, I suppose, first brought over in the Mayflower, did the business for America, and its influence is still rising, swelling, spreading, in cerealian billows over the land﻿—this seed I regularly and faithfully procured from the village, till at length one morning I forgot the rules, and scalded my yeast; by which accident I discovered that even this was not indispensable﻿—for my discoveries were not by the synthetic but analytic process﻿—and I have gladly omitted it since, though most housewives earnestly assured me that safe and wholesome bread without yeast might not be, and elderly people prophesied a speedy decay of the vital forces.",Likely physically present (positive sentiment)
America,39.7837304,-100.445882,"Such apparently slight causes destroyed Greece and Rome, and will destroy England and America.",Unclear
Spain,39.3260685,-4.8379791,"There’s nothing like it in old paintings, nothing like it in foreign lands﻿—unless when we were off the coast of Spain.",Unclear
Spain,39.3260685,-4.8379791,"England and France, Spain and Portugal, Gold Coast and Slave Coast, all front on this private sea; but no bark from them has ventured out of sight of land, though it is without doubt the direct way to India.",Unclear
Spain,39.3260685,-4.8379791,"As for Spain, for instance, if you know how to throw in Don Carlos and the Infanta, and Don Pedro and Seville and Granada, from time to time in the right proportions﻿—they may have changed the names a little since I saw the papers﻿—and serve up a bullfight when other entertainments fail, it will be true to the letter, and give us as good an idea of the exact state or ruin of things in Spain as the most succinct and lucid reports under this head in the newspapers: and as for England, almost the last significant scrap of news from that quarter was the revolution of 1649; and if you have learned the history of her crops for an average year, you never need attend to that thing again, unless your speculations are of a merely pecuniary character.",Physically present
Spain,39.3260685,-4.8379791,"As for Spain, for instance, if you know how to throw in Don Carlos and the Infanta, and Don Pedro and Seville and Granada, from time to time in the right proportions﻿—they may have changed the names a little since I saw the papers﻿—and serve up a bullfight when other entertainments fail, it will be true to the letter, and give us as good an idea of the exact state or ruin of things in Spain as the most succinct and lucid reports under this head in the newspapers: and as for England, almost the last significant scrap of news from that quarter was the revolution of 1649; and if you have learned the history of her crops for an average year, you never need attend to that thing again, unless your speculations are of a merely pecuniary character.",Physically present
Mediterranean,35.0000035,19.9999957,That’s a true Mediterranean sky.,Unclear
Brister’s Hill,42.44652602536891,-71.33549281708,"Commonly I rested an hour or two in the shade at noon, after planting, and ate my lunch, and read a little by a spring which was the source of a swamp and of a brook, oozing from under Brister’s Hill, half a mile from my field.",Unclear
Brister’s Hill,42.44652602536891,-71.33549281708,"Where now firm open fields stretch from the village to the woods, it then ran through a maple swamp on a foundation of logs, the remnants of which, doubtless, still underlie the present dusty highway, from the Stratton, now the Alms-House Farm, to Brister’s Hill.",Unclear
